{
  "apiVersion": "catalog.confighub.com/v1alpha1",
  "kind": "CatalogChart",
  "chartVersion": "1",
  "schema": "https://confighub.github.io/helm-expt/site/chart.schema.json",
  "chart": "istio/gateway",
  "format": "helm",
  "url": "https://confighub.github.io/helm-expt/site/charts/istio-gateway.json",
  "page": "https://confighub.github.io/helm-expt/site/charts/istio-gateway.html",
  "counts": {
    "versions": 1,
    "bases": 2
  },
  "versions": [
    {
      "version": "1.30.0",
      "page": "https://confighub.github.io/helm-expt/site/charts/istio-gateway-1-30-0.html",
      "defaultBase": "default",
      "package": {
        "published": true,
        "signed": true,
        "ociRef": "oci://europe-west1-docker.pkg.dev/nth-fort-499605-q5/helm-expt/istio-gateway:1.30.0@sha256:1c26ebf6dc73c2c3952755668886b33606cdbd62494776e4237e5e8402803b69"
      },
      "bases": [
        {
          "base": "default",
          "default": true,
          "listing": {
            "id": "istio-gateway-1-30-0-default",
            "url": "https://confighub.github.io/helm-expt/site/listings/istio-gateway-1-30-0-default.json"
          },
          "objectCount": 6,
          "verdict": "safe-to-flatten",
          "published": true,
          "flagged": false,
          "objects": {
            "path": "recipes/istio/gateway/1.30.0/revisions/default/r001/rendered/release-objects.yaml",
            "url": "https://raw.githubusercontent.com/confighub/helm-expt/main/recipes/istio/gateway/1.30.0/revisions/default/r001/rendered/release-objects.yaml",
            "sha256": "sha256:07b3cb11d265a7b857b231a347be2c71742e5bc1eeb02efddd7ce71ecc1c7afc",
            "objectSetDigest": "sha256:07b3cb11d265a7b857b231a347be2c71742e5bc1eeb02efddd7ce71ecc1c7afc"
          }
        },
        {
          "base": "controller-default-reviewed",
          "default": false,
          "listing": {
            "id": "istio-gateway-1-30-0-controller-default-reviewed",
            "url": "https://confighub.github.io/helm-expt/site/listings/istio-gateway-1-30-0-controller-default-reviewed.json"
          },
          "objectCount": 6,
          "verdict": "safe-to-flatten",
          "published": true,
          "flagged": false,
          "objects": {
            "path": "recipes/istio/gateway/1.30.0/revisions/controller-default-reviewed/r001/rendered/release-objects.yaml",
            "url": "https://raw.githubusercontent.com/confighub/helm-expt/main/recipes/istio/gateway/1.30.0/revisions/controller-default-reviewed/r001/rendered/release-objects.yaml",
            "sha256": "sha256:07b3cb11d265a7b857b231a347be2c71742e5bc1eeb02efddd7ce71ecc1c7afc",
            "objectSetDigest": "sha256:07b3cb11d265a7b857b231a347be2c71742e5bc1eeb02efddd7ce71ecc1c7afc"
          }
        }
      ]
    }
  ],
  "summaries": [],
  "compare": {
    "computedOnDemand": true,
    "core": {
      "command": "cub config diff",
      "repository": "https://github.com/confighub/cub-workshop",
      "commit": "55c51a67db2c9517e21bd3286207e28ff1a78ed3",
      "path": "lib/config-diff.mjs",
      "sha256": "9265ab17a157ef8b00171384f24ec58ae939aac210e5a1a4208a432dae4578b1"
    },
    "recipe": [
      "curl -fsSL -o before.yaml <objects.url of the first base>",
      "curl -fsSL -o after.yaml <objects.url of the second base>",
      "cub config diff before.yaml after.yaml --summary"
    ]
  },
  "liveExample": null
}
