{
  "apiVersion": "catalog.confighub.com/v1alpha1",
  "kind": "CatalogChart",
  "chartVersion": "1",
  "schema": "https://confighub.github.io/helm-expt/site/chart.schema.json",
  "chart": "dex/dex",
  "format": "helm",
  "url": "https://confighub.github.io/helm-expt/site/charts/dex-dex.json",
  "page": "https://confighub.github.io/helm-expt/site/charts/dex-dex.html",
  "counts": {
    "versions": 1,
    "bases": 1
  },
  "versions": [
    {
      "version": "0.24.0",
      "page": "https://confighub.github.io/helm-expt/site/charts/dex-dex-0-24-0.html",
      "defaultBase": "default",
      "package": {
        "published": true,
        "signed": true,
        "ociRef": "oci://europe-west1-docker.pkg.dev/nth-fort-499605-q5/helm-expt/dex-dex:0.24.0@sha256:0e2e1b873d9ce8f43b51023f3fe28131b3a021b7718e57d6250462421245793f"
      },
      "bases": [
        {
          "base": "default",
          "default": true,
          "listing": {
            "id": "dex-dex-0-24-0-default",
            "url": "https://confighub.github.io/helm-expt/site/listings/dex-dex-0-24-0-default.json"
          },
          "objectCount": 8,
          "verdict": "unsafe-to-flatten",
          "published": false,
          "flagged": false,
          "objects": {
            "path": "recipes/dex/dex/0.24.0/revisions/default/r001/rendered/release-objects.yaml",
            "url": "https://raw.githubusercontent.com/confighub/helm-expt/main/recipes/dex/dex/0.24.0/revisions/default/r001/rendered/release-objects.yaml",
            "sha256": "sha256:5461ff32d1a2a157fd54a958809a06aa73938f52efc8c97f40e866cbc070b2f5",
            "objectSetDigest": "sha256:5461ff32d1a2a157fd54a958809a06aa73938f52efc8c97f40e866cbc070b2f5"
          }
        }
      ]
    }
  ],
  "summaries": [],
  "compare": {
    "computedOnDemand": true,
    "core": {
      "command": "cub config diff",
      "repository": "https://github.com/confighub/cub-workshop",
      "commit": "55c51a67db2c9517e21bd3286207e28ff1a78ed3",
      "path": "lib/config-diff.mjs",
      "sha256": "9265ab17a157ef8b00171384f24ec58ae939aac210e5a1a4208a432dae4578b1"
    },
    "recipe": [
      "curl -fsSL -o before.yaml <objects.url of the first base>",
      "curl -fsSL -o after.yaml <objects.url of the second base>",
      "cub config diff before.yaml after.yaml --summary"
    ]
  },
  "liveExample": null
}
