{
  "apiVersion": "catalog.confighub.com/v1alpha1",
  "kind": "CatalogChart",
  "chartVersion": "1",
  "schema": "https://confighub.github.io/helm-expt/site/chart.schema.json",
  "chart": "minio-operator/operator",
  "format": "helm",
  "url": "https://confighub.github.io/helm-expt/site/charts/minio-operator-operator.json",
  "page": "https://confighub.github.io/helm-expt/site/charts/minio-operator-operator.html",
  "counts": {
    "versions": 1,
    "bases": 1
  },
  "versions": [
    {
      "version": "7.1.1",
      "page": "https://confighub.github.io/helm-expt/site/charts/minio-operator-operator-7-1-1.html",
      "defaultBase": "default",
      "package": {
        "published": true,
        "signed": true,
        "ociRef": "oci://europe-west1-docker.pkg.dev/nth-fort-499605-q5/helm-expt/minio-operator-operator:7.1.1@sha256:0847bb9ea8043ac6ba896416514decef6a007d9f5fbd7ecbe99bc1594377823a"
      },
      "bases": [
        {
          "base": "default",
          "default": true,
          "listing": {
            "id": "minio-operator-operator-7-1-1-default",
            "url": "https://confighub.github.io/helm-expt/site/listings/minio-operator-operator-7-1-1-default.json"
          },
          "objectCount": 8,
          "verdict": "flatten-with-routes",
          "published": true,
          "flagged": false,
          "objects": {
            "path": "recipes/minio-operator/operator/7.1.1/revisions/default/r001/rendered/release-objects.yaml",
            "url": "https://raw.githubusercontent.com/confighub/helm-expt/main/recipes/minio-operator/operator/7.1.1/revisions/default/r001/rendered/release-objects.yaml",
            "sha256": "sha256:3ac734cc8872f78365a7649830f706dc43341bba596b7ff266be2862f0f28b0a",
            "objectSetDigest": "sha256:3ac734cc8872f78365a7649830f706dc43341bba596b7ff266be2862f0f28b0a"
          }
        }
      ]
    }
  ],
  "summaries": [],
  "compare": {
    "computedOnDemand": true,
    "core": {
      "command": "cub config diff",
      "repository": "https://github.com/confighub/cub-workshop",
      "commit": "55c51a67db2c9517e21bd3286207e28ff1a78ed3",
      "path": "lib/config-diff.mjs",
      "sha256": "9265ab17a157ef8b00171384f24ec58ae939aac210e5a1a4208a432dae4578b1"
    },
    "recipe": [
      "curl -fsSL -o before.yaml <objects.url of the first base>",
      "curl -fsSL -o after.yaml <objects.url of the second base>",
      "cub config diff before.yaml after.yaml --summary"
    ]
  },
  "liveExample": null
}
