{
  "apiVersion": "catalog.confighub.com/v1alpha1",
  "kind": "CatalogChart",
  "chartVersion": "1",
  "schema": "https://confighub.github.io/helm-expt/site/chart.schema.json",
  "chart": "aws-controllers-k8s/ec2-chart",
  "format": "helm",
  "url": "https://confighub.github.io/helm-expt/site/charts/aws-controllers-k8s-ec2-chart.json",
  "page": "https://confighub.github.io/helm-expt/site/charts/aws-controllers-k8s-ec2-chart.html",
  "counts": {
    "versions": 1,
    "bases": 2
  },
  "versions": [
    {
      "version": "1.18.4",
      "page": "https://confighub.github.io/helm-expt/site/charts/aws-controllers-k8s-ec2-chart-1-18-4.html",
      "defaultBase": "default",
      "package": {
        "published": true,
        "signed": true,
        "ociRef": "oci://europe-west1-docker.pkg.dev/nth-fort-499605-q5/helm-expt/aws-controllers-k8s-ec2-chart:1.18.4@sha256:40806df17d8ff6732613c13d151c5eff9c1e9551389718a9f3d3dac68d9f3721"
      },
      "bases": [
        {
          "base": "default",
          "default": true,
          "listing": {
            "id": "aws-controllers-k8s-ec2-chart-1-18-4-default",
            "url": "https://confighub.github.io/helm-expt/site/listings/aws-controllers-k8s-ec2-chart-1-18-4-default.json"
          },
          "objectCount": 32,
          "verdict": "flatten-with-routes",
          "published": true,
          "flagged": false,
          "objects": {
            "path": "recipes/aws-controllers-k8s/ec2-chart/1.18.4/revisions/default/r001/rendered/release-objects.yaml",
            "url": "https://raw.githubusercontent.com/confighub/helm-expt/main/recipes/aws-controllers-k8s/ec2-chart/1.18.4/revisions/default/r001/rendered/release-objects.yaml",
            "sha256": "sha256:f554824764fd9d781aaea445b728b209a93a190ccd8865ccdf235139377fcc59",
            "objectSetDigest": "sha256:f554824764fd9d781aaea445b728b209a93a190ccd8865ccdf235139377fcc59"
          }
        },
        {
          "base": "eks-inference",
          "default": false,
          "listing": {
            "id": "aws-controllers-k8s-ec2-chart-1-18-4-eks-inference",
            "url": "https://confighub.github.io/helm-expt/site/listings/aws-controllers-k8s-ec2-chart-1-18-4-eks-inference.json"
          },
          "objectCount": 32,
          "verdict": "flatten-with-routes",
          "published": true,
          "flagged": false,
          "objects": {
            "path": "recipes/aws-controllers-k8s/ec2-chart/1.18.4/revisions/eks-inference/r001/rendered/release-objects.yaml",
            "url": "https://raw.githubusercontent.com/confighub/helm-expt/main/recipes/aws-controllers-k8s/ec2-chart/1.18.4/revisions/eks-inference/r001/rendered/release-objects.yaml",
            "sha256": "sha256:52eab19d8c3c6c160d3259bd15bc468fa31eb295238e0b428fda9e53b8514a7d",
            "objectSetDigest": "sha256:52eab19d8c3c6c160d3259bd15bc468fa31eb295238e0b428fda9e53b8514a7d"
          }
        }
      ]
    }
  ],
  "summaries": [],
  "compare": {
    "computedOnDemand": true,
    "core": {
      "command": "cub config diff",
      "repository": "https://github.com/confighub/cub-workshop",
      "commit": "55c51a67db2c9517e21bd3286207e28ff1a78ed3",
      "path": "lib/config-diff.mjs",
      "sha256": "9265ab17a157ef8b00171384f24ec58ae939aac210e5a1a4208a432dae4578b1"
    },
    "recipe": [
      "curl -fsSL -o before.yaml <objects.url of the first base>",
      "curl -fsSL -o after.yaml <objects.url of the second base>",
      "cub config diff before.yaml after.yaml --summary"
    ]
  },
  "liveExample": null
}
