{
  "apiVersion": "catalog.confighub.com/v1alpha1",
  "kind": "CatalogChart",
  "chartVersion": "1",
  "schema": "https://confighub.github.io/helm-expt/site/chart.schema.json",
  "chart": "sealed-secrets/sealed-secrets",
  "format": "helm",
  "url": "https://confighub.github.io/helm-expt/site/charts/sealed-secrets-sealed-secrets.json",
  "page": "https://confighub.github.io/helm-expt/site/charts/sealed-secrets-sealed-secrets.html",
  "counts": {
    "versions": 1,
    "bases": 2
  },
  "versions": [
    {
      "version": "2.18.6",
      "page": "https://confighub.github.io/helm-expt/site/charts/sealed-secrets-sealed-secrets-2-18-6.html",
      "defaultBase": "default",
      "package": {
        "published": true,
        "signed": true,
        "ociRef": "oci://europe-west1-docker.pkg.dev/nth-fort-499605-q5/helm-expt/sealed-secrets-sealed-secrets:2.18.6@sha256:15945be88b50c3b451a86f077258621434e78768b7655be0f758504849af8aa6"
      },
      "bases": [
        {
          "base": "default",
          "default": true,
          "listing": {
            "id": "sealed-secrets-sealed-secrets-2-18-6-default",
            "url": "https://confighub.github.io/helm-expt/site/listings/sealed-secrets-sealed-secrets-2-18-6-default.json"
          },
          "objectCount": 11,
          "verdict": "not-assessed",
          "published": false,
          "flagged": false,
          "objects": {
            "path": "recipes/sealed-secrets/sealed-secrets/2.18.6/revisions/default/r001/rendered/release-objects.yaml",
            "url": "https://raw.githubusercontent.com/confighub/helm-expt/main/recipes/sealed-secrets/sealed-secrets/2.18.6/revisions/default/r001/rendered/release-objects.yaml",
            "sha256": "sha256:096c66f4ea312aa7c3a4fc2be815b64271c3f1c829c8914b5c96c190aa22a83e",
            "objectSetDigest": "sha256:096c66f4ea312aa7c3a4fc2be815b64271c3f1c829c8914b5c96c190aa22a83e"
          }
        },
        {
          "base": "no-crds",
          "default": false,
          "listing": {
            "id": "sealed-secrets-sealed-secrets-2-18-6-no-crds",
            "url": "https://confighub.github.io/helm-expt/site/listings/sealed-secrets-sealed-secrets-2-18-6-no-crds.json"
          },
          "objectCount": 10,
          "verdict": "not-assessed",
          "published": false,
          "flagged": false,
          "objects": {
            "path": "recipes/sealed-secrets/sealed-secrets/2.18.6/revisions/no-crds/r001/rendered/release-objects.yaml",
            "url": "https://raw.githubusercontent.com/confighub/helm-expt/main/recipes/sealed-secrets/sealed-secrets/2.18.6/revisions/no-crds/r001/rendered/release-objects.yaml",
            "sha256": "sha256:8c271440bc9064522738add874400229e0dc0de35e39818aa29433f7d16c243c",
            "objectSetDigest": "sha256:8c271440bc9064522738add874400229e0dc0de35e39818aa29433f7d16c243c"
          }
        }
      ]
    }
  ],
  "summaries": [],
  "compare": {
    "computedOnDemand": true,
    "core": {
      "command": "cub config diff",
      "repository": "https://github.com/confighub/cub-workshop",
      "commit": "55c51a67db2c9517e21bd3286207e28ff1a78ed3",
      "path": "lib/config-diff.mjs",
      "sha256": "9265ab17a157ef8b00171384f24ec58ae939aac210e5a1a4208a432dae4578b1"
    },
    "recipe": [
      "curl -fsSL -o before.yaml <objects.url of the first base>",
      "curl -fsSL -o after.yaml <objects.url of the second base>",
      "cub config diff before.yaml after.yaml --summary"
    ]
  },
  "liveExample": null
}
